#-----------------------------------------------------------
# Vivado v2023.1 (64-bit)
# SW Build 3865809 on Sun May  7 15:05:29 MDT 2023
# IP Build 3864474 on Sun May  7 20:36:21 MDT 2023
# SharedData Build 3865790 on Sun May 07 13:33:03 MDT 2023
# Start of session at: Mon Oct 16 19:56:05 2023
# Process ID: 34720
# Current directory: C:/Users/lscho/Documents/GitHub/Digitaal-MO6-Pong/ScreenGen/WhiteScreenGen
# Command line: vivado.exe -gui_launcher_event rodinguilauncherevent36624 C:\Users\lscho\Documents\GitHub\Digitaal-MO6-Pong\ScreenGen\WhiteScreenGen\WhiteScreenGen.xpr
# Log file: C:/Users/lscho/Documents/GitHub/Digitaal-MO6-Pong/ScreenGen/WhiteScreenGen/vivado.log
# Journal file: C:/Users/lscho/Documents/GitHub/Digitaal-MO6-Pong/ScreenGen/WhiteScreenGen\vivado.jou
# Running On: DESKTOP-0BAPC61, OS: Windows, CPU Frequency: 3893 MHz, CPU Physical cores: 12, Host memory: 33746 MB
#-----------------------------------------------------------
start_gui
open_project C:/Users/lscho/Documents/GitHub/Digitaal-MO6-Pong/ScreenGen/WhiteScreenGen/WhiteScreenGen.xpr
Scanning sources...
Finished scanning sources
INFO: [IP_Flow 19-234] Refreshing IP repositories
INFO: [IP_Flow 19-1704] No user IP repositories specified
INFO: [IP_Flow 19-2313] Loaded Vivado IP repository 'D:/Vivado/Vivado/2023.1/data/ip'.
WARNING: [Board 49-26] cannot add Board Part xilinx.com:kc705:part0:1.6 available at D:/Vivado/Vivado/2023.1/data/xhub/boards/XilinxBoardStore/boards/Xilinx/kc705/1.6/board.xml as part xc7k325tffg900-2 specified in board_part file is either invalid or not available
WARNING: [Board 49-26] cannot add Board Part xilinx.com:kcu105:part0:1.6 available at D:/Vivado/Vivado/2023.1/data/xhub/boards/XilinxBoardStore/boards/Xilinx/kcu105/1.6/board.xml as part xcku040-ffva1156-2-e specified in board_part file is either invalid or not available
WARNING: [Board 49-26] cannot add Board Part xilinx.com:kcu105:part0:1.7 available at D:/Vivado/Vivado/2023.1/data/xhub/boards/XilinxBoardStore/boards/Xilinx/kcu105/1.7/board.xml as part xcku040-ffva1156-2-e specified in board_part file is either invalid or not available
WARNING: [Board 49-26] cannot add Board Part xilinx.com:kcu1500:part0:1.2 available at D:/Vivado/Vivado/2023.1/data/xhub/boards/XilinxBoardStore/boards/Xilinx/kcu1500/1.2/board.xml as part xcku115-flvb2104-2-e specified in board_part file is either invalid or not available
WARNING: [Board 49-26] cannot add Board Part xilinx.com:vc707:part0:1.4 available at D:/Vivado/Vivado/2023.1/data/xhub/boards/XilinxBoardStore/boards/Xilinx/vc707/1.4/board.xml as part xc7vx485tffg1761-2 specified in board_part file is either invalid or not available
WARNING: [Board 49-26] cannot add Board Part xilinx.com:vc709:part0:1.8 available at D:/Vivado/Vivado/2023.1/data/xhub/boards/XilinxBoardStore/boards/Xilinx/vc709/1.8/board.xml as part xc7vx690tffg1761-2 specified in board_part file is either invalid or not available
WARNING: [Board 49-26] cannot add Board Part xilinx.com:vck190:part0:2.2 available at D:/Vivado/Vivado/2023.1/data/xhub/boards/XilinxBoardStore/boards/Xilinx/vck190/production/2.2/board.xml as part xcvc1902-vsva2197-2mp-e-s specified in board_part file is either invalid or not available
WARNING: [Board 49-26] cannot add Board Part xilinx.com:vck190:part0:3.0 available at D:/Vivado/Vivado/2023.1/data/xhub/boards/XilinxBoardStore/boards/Xilinx/vck190/production/3.0/board.xml as part xcvc1902-vsva2197-2mp-e-s specified in board_part file is either invalid or not available
WARNING: [Board 49-26] cannot add Board Part xilinx.com:vck190:part0:3.1 available at D:/Vivado/Vivado/2023.1/data/xhub/boards/XilinxBoardStore/boards/Xilinx/vck190/production/3.1/board.xml as part xcvc1902-vsva2197-2mp-e-s specified in board_part file is either invalid or not available
WARNING: [Board 49-26] cannot add Board Part xilinx.com:vck190:part0:3.2 available at D:/Vivado/Vivado/2023.1/data/xhub/boards/XilinxBoardStore/boards/Xilinx/vck190/production/3.2/board.xml as part xcvc1902-vsva2197-2mp-e-s specified in board_part file is either invalid or not available
WARNING: [Board 49-26] cannot add Board Part xilinx.com:vck190_newl:part0:1.0 available at D:/Vivado/Vivado/2023.1/data/xhub/boards/XilinxBoardStore/boards/Xilinx/vck190_newl/production/1.0/board.xml as part xcvc1902-vsva2197-2mp-e-s specified in board_part file is either invalid or not available
WARNING: [Board 49-26] cannot add Board Part xilinx.com:vck190_newl:part0:1.1 available at D:/Vivado/Vivado/2023.1/data/xhub/boards/XilinxBoardStore/boards/Xilinx/vck190_newl/production/1.1/board.xml as part xcvc1902-vsva2197-2mp-e-s specified in board_part file is either invalid or not available
WARNING: [Board 49-26] cannot add Board Part xilinx.com:vcu108:part0:1.6 available at D:/Vivado/Vivado/2023.1/data/xhub/boards/XilinxBoardStore/boards/Xilinx/vcu108/1.6/board.xml as part xcvu095-ffva2104-2-e specified in board_part file is either invalid or not available
WARNING: [Board 49-26] cannot add Board Part xilinx.com:vcu108:part0:1.7 available at D:/Vivado/Vivado/2023.1/data/xhub/boards/XilinxBoardStore/boards/Xilinx/vcu108/1.7/board.xml as part xcvu095-ffva2104-2-e specified in board_part file is either invalid or not available
WARNING: [Board 49-26] cannot add Board Part xilinx.com:vcu110:part0:1.4 available at D:/Vivado/Vivado/2023.1/data/xhub/boards/XilinxBoardStore/boards/Xilinx/vcu110/1.4/board.xml as part xcvu190-flgc2104-2-e specified in board_part file is either invalid or not available
WARNING: [Board 49-26] cannot add Board Part xilinx.com:vcu118:part0:2.0 available at D:/Vivado/Vivado/2023.1/data/xhub/boards/XilinxBoardStore/boards/Xilinx/vcu118/2.0/board.xml as part xcvu9p-flga2104-2l-e specified in board_part file is either invalid or not available
WARNING: [Board 49-26] cannot add Board Part xilinx.com:vcu118:part0:2.3 available at D:/Vivado/Vivado/2023.1/data/xhub/boards/XilinxBoardStore/boards/Xilinx/vcu118/2.3/board.xml as part xcvu9p-flga2104-2l-e specified in board_part file is either invalid or not available
WARNING: [Board 49-26] cannot add Board Part xilinx.com:vcu118:part0:2.4 available at D:/Vivado/Vivado/2023.1/data/xhub/boards/XilinxBoardStore/boards/Xilinx/vcu118/2.4/board.xml as part xcvu9p-flga2104-2l-e specified in board_part file is either invalid or not available
WARNING: [Board 49-26] cannot add Board Part xilinx.com:vcu129:part0:1.0 available at D:/Vivado/Vivado/2023.1/data/xhub/boards/XilinxBoardStore/boards/Xilinx/vcu129/production/1.0/board.xml as part xcvu29p-fsga2577-2l-e specified in board_part file is either invalid or not available
WARNING: [Board 49-26] cannot add Board Part xilinx.com:vcu1525:part0:1.3 available at D:/Vivado/Vivado/2023.1/data/xhub/boards/XilinxBoardStore/boards/Xilinx/vcu1525/1.3/board.xml as part xcvu9p-fsgd2104-2l-e specified in board_part file is either invalid or not available
WARNING: [Board 49-26] cannot add Board Part xilinx.com:vek280_es:part0:1.0 available at D:/Vivado/Vivado/2023.1/data/xhub/boards/XilinxBoardStore/boards/Xilinx/vek280/es/rev_a/1.0/board.xml as part xcve2802-vsvh1760-2lp-e-s-es1 specified in board_part file is either invalid or not available
WARNING: [Board 49-26] cannot add Board Part xilinx.com:vek280_es:part0:1.1 available at D:/Vivado/Vivado/2023.1/data/xhub/boards/XilinxBoardStore/boards/Xilinx/vek280/es/rev_a/1.1/board.xml as part xcve2802-vsvh1760-2lp-e-s-es1 specified in board_part file is either invalid or not available
WARNING: [Board 49-26] cannot add Board Part xilinx.com:vek280_es_revb:part0:1.0 available at D:/Vivado/Vivado/2023.1/data/xhub/boards/XilinxBoardStore/boards/Xilinx/vek280/es/rev_b/1.0/board.xml as part xcve2802-vsvh1760-2mp-e-s-es1 specified in board_part file is either invalid or not available
WARNING: [Board 49-26] cannot add Board Part xilinx.com:vek280_es_revb:part0:1.1 available at D:/Vivado/Vivado/2023.1/data/xhub/boards/XilinxBoardStore/boards/Xilinx/vek280/es/rev_b/1.1/board.xml as part xcve2802-vsvh1760-2mp-e-s-es1 specified in board_part file is either invalid or not available
WARNING: [Board 49-26] cannot add Board Part xilinx.com:vermeo_t1_mpsoc:part0:1.0 available at D:/Vivado/Vivado/2023.1/data/xhub/boards/XilinxBoardStore/boards/Xilinx/vermeo_t1_mpsoc/1.0/board.xml as part xczu19eg-ffvd1760-2l-e specified in board_part file is either invalid or not available
WARNING: [Board 49-26] cannot add Board Part xilinx.com:vermeo_t1_rfsoc:part0:1.0 available at D:/Vivado/Vivado/2023.1/data/xhub/boards/XilinxBoardStore/boards/Xilinx/vermeo_t1_rfsoc/1.0/board.xml as part xczu21dr-ffvd1156-2l-e specified in board_part file is either invalid or not available
WARNING: [Board 49-26] cannot add Board Part xilinx.com:vhk158:part0:1.0 available at D:/Vivado/Vivado/2023.1/data/xhub/boards/XilinxBoardStore/boards/Xilinx/vhk158/production/1.0/board.xml as part xcvh1582-vsva3697-2mp-e-s specified in board_part file is either invalid or not available
WARNING: [Board 49-26] cannot add Board Part xilinx.com:vhk158_es:part0:1.0 available at D:/Vivado/Vivado/2023.1/data/xhub/boards/XilinxBoardStore/boards/Xilinx/vhk158/es/1.0/board.xml as part xcvh1582-vsva3697-2mp-e-s-es1 specified in board_part file is either invalid or not available
WARNING: [Board 49-26] cannot add Board Part xilinx.com:vhk158_es:part0:1.1 available at D:/Vivado/Vivado/2023.1/data/xhub/boards/XilinxBoardStore/boards/Xilinx/vhk158/es/1.1/board.xml as part xcvh1582-vsva3697-2mp-e-s-es1 specified in board_part file is either invalid or not available
WARNING: [Board 49-26] cannot add Board Part xilinx.com:vmk180:part0:2.2 available at D:/Vivado/Vivado/2023.1/data/xhub/boards/XilinxBoardStore/boards/Xilinx/vmk180/production/2.2/board.xml as part xcvm1802-vsva2197-2mp-e-s specified in board_part file is either invalid or not available
WARNING: [Board 49-26] cannot add Board Part xilinx.com:vmk180:part0:3.0 available at D:/Vivado/Vivado/2023.1/data/xhub/boards/XilinxBoardStore/boards/Xilinx/vmk180/production/3.0/board.xml as part xcvm1802-vsva2197-2mp-e-s specified in board_part file is either invalid or not available
WARNING: [Board 49-26] cannot add Board Part xilinx.com:vmk180:part0:3.1 available at D:/Vivado/Vivado/2023.1/data/xhub/boards/XilinxBoardStore/boards/Xilinx/vmk180/production/3.1/board.xml as part xcvm1802-vsva2197-2mp-e-s specified in board_part file is either invalid or not available
WARNING: [Board 49-26] cannot add Board Part xilinx.com:vmk180:part0:3.2 available at D:/Vivado/Vivado/2023.1/data/xhub/boards/XilinxBoardStore/boards/Xilinx/vmk180/production/3.2/board.xml as part xcvm1802-vsva2197-2mp-e-s specified in board_part file is either invalid or not available
WARNING: [Board 49-26] cannot add Board Part xilinx.com:vmk180_newl:part0:1.0 available at D:/Vivado/Vivado/2023.1/data/xhub/boards/XilinxBoardStore/boards/Xilinx/vmk180_newl/production/1.0/board.xml as part xcvm1802-vsva2197-2mp-e-s specified in board_part file is either invalid or not available
WARNING: [Board 49-26] cannot add Board Part xilinx.com:vmk180_newl:part0:1.1 available at D:/Vivado/Vivado/2023.1/data/xhub/boards/XilinxBoardStore/boards/Xilinx/vmk180_newl/production/1.1/board.xml as part xcvm1802-vsva2197-2mp-e-s specified in board_part file is either invalid or not available
WARNING: [Board 49-26] cannot add Board Part xilinx.com:vpk120:part0:1.0 available at D:/Vivado/Vivado/2023.1/data/xhub/boards/XilinxBoardStore/boards/Xilinx/vpk120/production/1.0/board.xml as part xcvp1202-vsva2785-2mp-e-s specified in board_part file is either invalid or not available
WARNING: [Board 49-26] cannot add Board Part xilinx.com:vpk120:part0:1.1 available at D:/Vivado/Vivado/2023.1/data/xhub/boards/XilinxBoardStore/boards/Xilinx/vpk120/production/1.1/board.xml as part xcvp1202-vsva2785-2mp-e-s specified in board_part file is either invalid or not available
WARNING: [Board 49-26] cannot add Board Part xilinx.com:vpk120_es:part0:1.2 available at D:/Vivado/Vivado/2023.1/data/xhub/boards/XilinxBoardStore/boards/Xilinx/vpk120/es/1.2/board.xml as part xcvp1202-vsva2785-2mp-e-s-es1 specified in board_part file is either invalid or not available
WARNING: [Board 49-26] cannot add Board Part xilinx.com:vpk120_es:part0:1.3 available at D:/Vivado/Vivado/2023.1/data/xhub/boards/XilinxBoardStore/boards/Xilinx/vpk120/es/1.3/board.xml as part xcvp1202-vsva2785-2mp-e-s-es1 specified in board_part file is either invalid or not available
WARNING: [Board 49-26] cannot add Board Part xilinx.com:vpk120_es_revb:part0:1.0 available at D:/Vivado/Vivado/2023.1/data/xhub/boards/XilinxBoardStore/boards/Xilinx/vpk120_revb/es/1.0/board.xml as part xcvp1202-vsva2785-2mp-e-s-es1 specified in board_part file is either invalid or not available
WARNING: [Board 49-26] cannot add Board Part xilinx.com:vpk120_es_revb:part0:1.1 available at D:/Vivado/Vivado/2023.1/data/xhub/boards/XilinxBoardStore/boards/Xilinx/vpk120_revb/es/1.1/board.xml as part xcvp1202-vsva2785-2mp-e-s-es1 specified in board_part file is either invalid or not available
WARNING: [Board 49-26] cannot add Board Part xilinx.com:vpk180:part0:1.0 available at D:/Vivado/Vivado/2023.1/data/xhub/boards/XilinxBoardStore/boards/Xilinx/vpk180/production/1.0/board.xml as part xcvp1802-lsvc4072-2mp-e-s specified in board_part file is either invalid or not available
WARNING: [Board 49-26] cannot add Board Part xilinx.com:vpk180:part0:1.1 available at D:/Vivado/Vivado/2023.1/data/xhub/boards/XilinxBoardStore/boards/Xilinx/vpk180/production/1.1/board.xml as part xcvp1802-lsvc4072-2mp-e-s specified in board_part file is either invalid or not available
WARNING: [Board 49-26] cannot add Board Part xilinx.com:vpk180_es:part0:1.0 available at D:/Vivado/Vivado/2023.1/data/xhub/boards/XilinxBoardStore/boards/Xilinx/vpk180/es/1.0/board.xml as part xcvp1802-lsvc4072-2mp-e-s-es1 specified in board_part file is either invalid or not available
WARNING: [Board 49-26] cannot add Board Part xilinx.com:vpk180_es:part0:1.1 available at D:/Vivado/Vivado/2023.1/data/xhub/boards/XilinxBoardStore/boards/Xilinx/vpk180/es/1.1/board.xml as part xcvp1802-lsvc4072-2mp-e-s-es1 specified in board_part file is either invalid or not available
WARNING: [Board 49-26] cannot add Board Part xilinx.com:zc706:part0:1.4 available at D:/Vivado/Vivado/2023.1/data/xhub/boards/XilinxBoardStore/boards/Xilinx/zc706/1.4/board.xml as part xc7z045ffg900-2 specified in board_part file is either invalid or not available
WARNING: [Board 49-26] cannot add Board Part xilinx.com:zcu102:part0:3.3 available at D:/Vivado/Vivado/2023.1/data/xhub/boards/XilinxBoardStore/boards/Xilinx/zcu102/3.3/board.xml as part xczu9eg-ffvb1156-2-e specified in board_part file is either invalid or not available
WARNING: [Board 49-26] cannot add Board Part xilinx.com:zcu102:part0:3.4 available at D:/Vivado/Vivado/2023.1/data/xhub/boards/XilinxBoardStore/boards/Xilinx/zcu102/3.4/board.xml as part xczu9eg-ffvb1156-2-e specified in board_part file is either invalid or not available
WARNING: [Board 49-26] cannot add Board Part xilinx.com:zcu111:part0:1.2 available at D:/Vivado/Vivado/2023.1/data/xhub/boards/XilinxBoardStore/boards/Xilinx/zcu111/1.2/board.xml as part xczu28dr-ffvg1517-2-e specified in board_part file is either invalid or not available
WARNING: [Board 49-26] cannot add Board Part xilinx.com:zcu111:part0:1.3 available at D:/Vivado/Vivado/2023.1/data/xhub/boards/XilinxBoardStore/boards/Xilinx/zcu111/1.3/board.xml as part xczu28dr-ffvg1517-2-e specified in board_part file is either invalid or not available
WARNING: [Board 49-26] cannot add Board Part xilinx.com:zcu111:part0:1.4 available at D:/Vivado/Vivado/2023.1/data/xhub/boards/XilinxBoardStore/boards/Xilinx/zcu111/1.4/board.xml as part xczu28dr-ffvg1517-2-e specified in board_part file is either invalid or not available
WARNING: [Board 49-26] cannot add Board Part xilinx.com:zcu1275:part0:1.0 available at D:/Vivado/Vivado/2023.1/data/xhub/boards/XilinxBoardStore/boards/Xilinx/zcu1275/1.0/board.xml as part xczu29dr-ffvf1760-2-e specified in board_part file is either invalid or not available
WARNING: [Board 49-26] cannot add Board Part xilinx.com:zcu1285:part0:1.0 available at D:/Vivado/Vivado/2023.1/data/xhub/boards/XilinxBoardStore/boards/Xilinx/zcu1285/1.0/board.xml as part xczu39dr-ffvf1760-2-i specified in board_part file is either invalid or not available
WARNING: [Board 49-26] cannot add Board Part xilinx.com:zcu208:part0:2.0 available at D:/Vivado/Vivado/2023.1/data/xhub/boards/XilinxBoardStore/boards/Xilinx/zcu208/production/2.0/board.xml as part xczu48dr-fsvg1517-2-e specified in board_part file is either invalid or not available
WARNING: [Board 49-26] cannot add Board Part xilinx.com:zcu208ld:part0:2.0 available at D:/Vivado/Vivado/2023.1/data/xhub/boards/XilinxBoardStore/boards/Xilinx/zcu208ld/production/2.0/board.xml as part xczu58dr-fsvg1517-2-i specified in board_part file is either invalid or not available
WARNING: [Board 49-26] cannot add Board Part xilinx.com:zcu216:part0:2.0 available at D:/Vivado/Vivado/2023.1/data/xhub/boards/XilinxBoardStore/boards/Xilinx/zcu216/production/2.0/board.xml as part xczu49dr-ffvf1760-2-e specified in board_part file is either invalid or not available
WARNING: [Board 49-26] cannot add Board Part xilinx.com:zcu216ld:part0:2.0 available at D:/Vivado/Vivado/2023.1/data/xhub/boards/XilinxBoardStore/boards/Xilinx/zcu216ld/production/2.0/board.xml as part xczu59dr-ffvf1760-2-i specified in board_part file is either invalid or not available
WARNING: [Board 49-26] cannot add Board Part xilinx.com:zcu670:part0:2.0 available at D:/Vivado/Vivado/2023.1/data/xhub/boards/XilinxBoardStore/boards/Xilinx/zcu670/2.0/board.xml as part xczu67dr-fsve1156-2-i specified in board_part file is either invalid or not available
WARNING: [Board 49-26] cannot add Board Part xilinx.com:zcu670ld:part0:1.0 available at D:/Vivado/Vivado/2023.1/data/xhub/boards/XilinxBoardStore/boards/Xilinx/zcu670ld/1.0/board.xml as part xczu57dr-fsve1156-2-i specified in board_part file is either invalid or not available
open_project: Time (s): cpu = 00:00:20 ; elapsed = 00:00:08 . Memory (MB): peak = 1491.598 ; gain = 222.215
update_compile_order -fileset sources_1
open_hw_manager
connect_hw_server -allow_non_jtag
INFO: [Labtools 27-2285] Connecting to hw_server url TCP:localhost:3121
INFO: [Labtools 27-2222] Launching hw_server...
INFO: [Labtools 27-2221] Launch Output:
ECHO is off.
ECHO is off.

****** Xilinx hw_server v2023.1
  **** Build date : May  7 2023 at 15:26:57
    ** Copyright 1986-2022 Xilinx, Inc. All Rights Reserved.


INFO: [Labtools 27-3415] Connecting to cs_server url TCP:localhost:0
INFO: [Labtools 27-3417] Launching cs_server...
INFO: [Labtools 27-2221] Launch Output:
ECHO is off.
ECHO is off.


******** Xilinx cs_server v2023.1.0
  ****** Build date   : Apr 10 2023-17:59:24
    **** Build number : 2023.1.1681142364
      ** Copyright 2017-2022 Xilinx, Inc. All Rights Reserved.
      ** Copyright 2022-2023 Advanced Micro Devices, Inc. All Rights Reserved.



reset_run impl_1 -prev_step 
launch_runs impl_1 -to_step write_bitstream -jobs 12
[Mon Oct 16 19:56:57 2023] Launched impl_1...
Run output will be captured here: C:/Users/lscho/Documents/GitHub/Digitaal-MO6-Pong/ScreenGen/WhiteScreenGen/WhiteScreenGen.runs/impl_1/runme.log
disconnect_hw_server localhost:3121
connect_hw_server -allow_non_jtag
INFO: [Labtools 27-2285] Connecting to hw_server url TCP:localhost:3121
INFO: [Labtools 27-3415] Connecting to cs_server url TCP:localhost:0
INFO: [Labtools 27-3417] Launching cs_server...
INFO: [Labtools 27-2221] Launch Output:
ECHO is off.
ECHO is off.


******** Xilinx cs_server v2023.1.0
  ****** Build date   : Apr 10 2023-17:59:24
    **** Build number : 2023.1.1681142364
      ** Copyright 2017-2022 Xilinx, Inc. All Rights Reserved.
      ** Copyright 2022-2023 Advanced Micro Devices, Inc. All Rights Reserved.



ERROR: [Labtoolstcl 44-494] There is no active target available for server at localhost.
 Targets(s) ", jsn-€2-1234-tulA" may be locked by another hw_server.
open_bd_design {C:/Users/lscho/Documents/GitHub/Digitaal-MO6-Pong/ScreenGen/WhiteScreenGen/WhiteScreenGen.srcs/sources_1/bd/design_1/design_1.bd}
Reading block design file <C:/Users/lscho/Documents/GitHub/Digitaal-MO6-Pong/ScreenGen/WhiteScreenGen/WhiteScreenGen.srcs/sources_1/bd/design_1/design_1.bd>...
Adding component instance block -- xilinx.com:ip:clk_wiz:6.0 - clk_wiz
Adding component instance block -- xilinx.com:module_ref:WhiteScreenGen:1.0 - WhiteScreenGen_0
Successfully read diagram <design_1> from block design file <C:/Users/lscho/Documents/GitHub/Digitaal-MO6-Pong/ScreenGen/WhiteScreenGen/WhiteScreenGen.srcs/sources_1/bd/design_1/design_1.bd>
open_bd_design: Time (s): cpu = 00:00:05 ; elapsed = 00:00:07 . Memory (MB): peak = 1673.855 ; gain = 88.031
create_ip_run [get_files -of_objects [get_fileset sources_1] C:/Users/lscho/Documents/GitHub/Digitaal-MO6-Pong/ScreenGen/WhiteScreenGen/WhiteScreenGen.srcs/sources_1/bd/design_1/design_1.bd]
synth_design -top design_1_wrapper -part xc7z020clg400-1 -lint 
Command: synth_design -top design_1_wrapper -part xc7z020clg400-1 -lint
Starting synth_design
Attempting to get a license for feature 'Synthesis' and/or device 'xc7z020'
INFO: [Common 17-349] Got license for feature 'Synthesis' and/or device 'xc7z020'
INFO: [Device 21-403] Loading part xc7z020clg400-1
---------------------------------------------------------------------------------
Starting RTL Elaboration : Time (s): cpu = 00:00:04 ; elapsed = 00:00:04 . Memory (MB): peak = 2501.020 ; gain = 395.852
---------------------------------------------------------------------------------
Clean up Linter database...
INFO: [Synth 8-638] synthesizing module 'design_1_wrapper' [C:/Users/lscho/Documents/GitHub/Digitaal-MO6-Pong/ScreenGen/WhiteScreenGen/WhiteScreenGen.gen/sources_1/bd/design_1/hdl/design_1_wrapper.vhd:26]
INFO: [Synth 8-3491] module 'design_1' declared at 'c:/Users/lscho/Documents/GitHub/Digitaal-MO6-Pong/ScreenGen/WhiteScreenGen/WhiteScreenGen.gen/sources_1/bd/design_1/synth/design_1.vhd:15' bound to instance 'design_1_i' of component 'design_1' [C:/Users/lscho/Documents/GitHub/Digitaal-MO6-Pong/ScreenGen/WhiteScreenGen/WhiteScreenGen.gen/sources_1/bd/design_1/hdl/design_1_wrapper.vhd:38]
INFO: [Synth 8-638] synthesizing module 'design_1' [c:/Users/lscho/Documents/GitHub/Digitaal-MO6-Pong/ScreenGen/WhiteScreenGen/WhiteScreenGen.gen/sources_1/bd/design_1/synth/design_1.vhd:30]
INFO: [Synth 8-3491] module 'design_1_WhiteScreenGen_0_0' declared at 'C:/Users/lscho/Documents/GitHub/Digitaal-MO6-Pong/ScreenGen/WhiteScreenGen/.Xil/Vivado-34720-DESKTOP-0BAPC61/realtime/design_1_WhiteScreenGen_0_0_stub.vhdl:6' bound to instance 'WhiteScreenGen_0' of component 'design_1_WhiteScreenGen_0_0' [c:/Users/lscho/Documents/GitHub/Digitaal-MO6-Pong/ScreenGen/WhiteScreenGen/WhiteScreenGen.gen/sources_1/bd/design_1/synth/design_1.vhd:71]
INFO: [Synth 8-638] synthesizing module 'design_1_WhiteScreenGen_0_0' [C:/Users/lscho/Documents/GitHub/Digitaal-MO6-Pong/ScreenGen/WhiteScreenGen/.Xil/Vivado-34720-DESKTOP-0BAPC61/realtime/design_1_WhiteScreenGen_0_0_stub.vhdl:19]
INFO: [Synth 8-3491] module 'design_1_clk_wiz_0' declared at 'C:/Users/lscho/Documents/GitHub/Digitaal-MO6-Pong/ScreenGen/WhiteScreenGen/.Xil/Vivado-34720-DESKTOP-0BAPC61/realtime/design_1_clk_wiz_0_stub.vhdl:6' bound to instance 'clk_wiz' of component 'design_1_clk_wiz_0' [c:/Users/lscho/Documents/GitHub/Digitaal-MO6-Pong/ScreenGen/WhiteScreenGen/WhiteScreenGen.gen/sources_1/bd/design_1/synth/design_1.vhd:81]
INFO: [Synth 8-638] synthesizing module 'design_1_clk_wiz_0' [C:/Users/lscho/Documents/GitHub/Digitaal-MO6-Pong/ScreenGen/WhiteScreenGen/.Xil/Vivado-34720-DESKTOP-0BAPC61/realtime/design_1_clk_wiz_0_stub.vhdl:17]
INFO: [Synth 8-256] done synthesizing module 'design_1' (1#1) [c:/Users/lscho/Documents/GitHub/Digitaal-MO6-Pong/ScreenGen/WhiteScreenGen/WhiteScreenGen.gen/sources_1/bd/design_1/synth/design_1.vhd:30]
INFO: [Synth 8-256] done synthesizing module 'design_1_wrapper' (2#1) [C:/Users/lscho/Documents/GitHub/Digitaal-MO6-Pong/ScreenGen/WhiteScreenGen/WhiteScreenGen.gen/sources_1/bd/design_1/hdl/design_1_wrapper.vhd:26]
---------------------------------------------------------------------------------
Finished RTL Elaboration : Time (s): cpu = 00:00:06 ; elapsed = 00:00:06 . Memory (MB): peak = 2591.211 ; gain = 486.043
---------------------------------------------------------------------------------
Copyright 1986-2022 Xilinx, Inc. All Rights Reserved. Copyright 2022-2023 Advanced Micro Devices, Inc. All Rights Reserved.
---------------------------------------------------------------------------------------------------------------------------------------------
| Tool Version : Vivado v.2023.1 (win64) Build 3865809 Sun May  7 15:05:29 MDT 2023
| Date         : Mon Oct 16 19:59:10 2023
| Host         : DESKTOP-0BAPC61 running 64-bit major release  (build 9200)
---------------------------------------------------------------------------------------------------------------------------------------------

RTL Linter Report

Table of Contents
-----------------
1. Summary

1. Summary
----------

+----------+--------------+----------+
| Rule ID  | # Violations | # Waived |
+----------+--------------+----------+
| ASSIGN-6 | 1            | 0        |
+----------+--------------+----------+


WARNING: [Synth 37-93] [ASSIGN-6]Signal 'NLW_clk_wiz_locked_UNCONNECTED' was assigned but not read. 
RTL Name 'NLW_clk_wiz_locked_UNCONNECTED', Hierarchy 'design_1', File 'c:/Users/lscho/Documents/GitHub/Digitaal-MO6-Pong/ScreenGen/WhiteScreenGen/WhiteScreenGen.gen/sources_1/bd/design_1/synth/design_1.vhd', Line 59.
INFO: [Synth 37-85] Total of 1 linter message(s) generated.
INFO: [Synth 37-45] Linter Run Finished!
INFO: [Project 1-454] Reading design checkpoint 'c:/Users/lscho/Documents/GitHub/Digitaal-MO6-Pong/ScreenGen/WhiteScreenGen/WhiteScreenGen.gen/sources_1/bd/design_1/ip/design_1_WhiteScreenGen_0_0/design_1_WhiteScreenGen_0_0.dcp' for cell 'design_1_i/WhiteScreenGen_0'
INFO: [Project 1-454] Reading design checkpoint 'c:/Users/lscho/Documents/GitHub/Digitaal-MO6-Pong/ScreenGen/WhiteScreenGen/WhiteScreenGen.gen/sources_1/bd/design_1/ip/design_1_clk_wiz_0/design_1_clk_wiz_0.dcp' for cell 'design_1_i/clk_wiz'
Netlist sorting complete. Time (s): cpu = 00:00:00 ; elapsed = 00:00:00 . Memory (MB): peak = 2591.211 ; gain = 0.000
INFO: [Netlist 29-17] Analyzing 1 Unisim elements for replacement
INFO: [Netlist 29-28] Unisim Transformation completed in 0 CPU seconds
INFO: [Project 1-479] Netlist was created with Vivado 2023.1
INFO: [Project 1-570] Preparing netlist for logic optimization
INFO: [Opt 31-141] Inserted 5 OBUFs to IO ports without IO buffers.

Processing XDC Constraints
Initializing timing engine
Parsing XDC File [c:/Users/lscho/Documents/GitHub/Digitaal-MO6-Pong/ScreenGen/WhiteScreenGen/WhiteScreenGen.gen/sources_1/bd/design_1/ip/design_1_clk_wiz_0/design_1_clk_wiz_0_board.xdc] for cell 'design_1_i/clk_wiz/inst'
Finished Parsing XDC File [c:/Users/lscho/Documents/GitHub/Digitaal-MO6-Pong/ScreenGen/WhiteScreenGen/WhiteScreenGen.gen/sources_1/bd/design_1/ip/design_1_clk_wiz_0/design_1_clk_wiz_0_board.xdc] for cell 'design_1_i/clk_wiz/inst'
Parsing XDC File [c:/Users/lscho/Documents/GitHub/Digitaal-MO6-Pong/ScreenGen/WhiteScreenGen/WhiteScreenGen.gen/sources_1/bd/design_1/ip/design_1_clk_wiz_0/design_1_clk_wiz_0.xdc] for cell 'design_1_i/clk_wiz/inst'
Finished Parsing XDC File [c:/Users/lscho/Documents/GitHub/Digitaal-MO6-Pong/ScreenGen/WhiteScreenGen/WhiteScreenGen.gen/sources_1/bd/design_1/ip/design_1_clk_wiz_0/design_1_clk_wiz_0.xdc] for cell 'design_1_i/clk_wiz/inst'
INFO: [Project 1-236] Implementation specific constraints were found while reading constraint file [c:/Users/lscho/Documents/GitHub/Digitaal-MO6-Pong/ScreenGen/WhiteScreenGen/WhiteScreenGen.gen/sources_1/bd/design_1/ip/design_1_clk_wiz_0/design_1_clk_wiz_0.xdc]. These constraints will be ignored for synthesis but will be used in implementation. Impacted constraints are listed in the file [.Xil/design_1_wrapper_propImpl.xdc].
Resolution: To avoid this warning, move constraints listed in [.Xil/design_1_wrapper_propImpl.xdc] to another XDC file and exclude this new file from synthesis with the used_in_synthesis property (File Properties dialog in GUI) and re-run elaboration/synthesis.
INFO: [Timing 38-2] Deriving generated clocks
Parsing XDC File [C:/Users/lscho/Documents/GitHub/Digitaal-MO6-Pong/ScreenGen/WhiteScreenGen/WhiteScreenGen.srcs/constrs_1/new/pindef.xdc]
Finished Parsing XDC File [C:/Users/lscho/Documents/GitHub/Digitaal-MO6-Pong/ScreenGen/WhiteScreenGen/WhiteScreenGen.srcs/constrs_1/new/pindef.xdc]
Completed Processing XDC Constraints

INFO: [Opt 31-138] Pushed 0 inverter(s) to 0 load pin(s).
Netlist sorting complete. Time (s): cpu = 00:00:00 ; elapsed = 00:00:00 . Memory (MB): peak = 2600.090 ; gain = 0.000
INFO: [Common 17-83] Releasing license: Synthesis
24 Infos, 1 Warnings, 0 Critical Warnings and 0 Errors encountered.
synth_design completed successfully
synth_design: Time (s): cpu = 00:00:11 ; elapsed = 00:00:12 . Memory (MB): peak = 2600.090 ; gain = 894.953
create_ip_run [get_files -of_objects [get_fileset sources_1] C:/Users/lscho/Documents/GitHub/Digitaal-MO6-Pong/ScreenGen/WhiteScreenGen/WhiteScreenGen.srcs/sources_1/bd/design_1/design_1.bd]
synth_design -rtl -rtl_skip_mlo -name rtl_1
Command: synth_design -rtl -rtl_skip_mlo -name rtl_1
Starting synth_design
Using part: xc7z020clg400-1
Top: design_1_wrapper
---------------------------------------------------------------------------------
Starting RTL Elaboration : Time (s): cpu = 00:00:05 ; elapsed = 00:00:04 . Memory (MB): peak = 2600.090 ; gain = 0.000
---------------------------------------------------------------------------------
INFO: [Synth 8-638] synthesizing module 'design_1_wrapper' [C:/Users/lscho/Documents/GitHub/Digitaal-MO6-Pong/ScreenGen/WhiteScreenGen/WhiteScreenGen.gen/sources_1/bd/design_1/hdl/design_1_wrapper.vhd:26]
INFO: [Synth 8-3491] module 'design_1' declared at 'c:/Users/lscho/Documents/GitHub/Digitaal-MO6-Pong/ScreenGen/WhiteScreenGen/WhiteScreenGen.gen/sources_1/bd/design_1/synth/design_1.vhd:15' bound to instance 'design_1_i' of component 'design_1' [C:/Users/lscho/Documents/GitHub/Digitaal-MO6-Pong/ScreenGen/WhiteScreenGen/WhiteScreenGen.gen/sources_1/bd/design_1/hdl/design_1_wrapper.vhd:38]
INFO: [Synth 8-638] synthesizing module 'design_1' [c:/Users/lscho/Documents/GitHub/Digitaal-MO6-Pong/ScreenGen/WhiteScreenGen/WhiteScreenGen.gen/sources_1/bd/design_1/synth/design_1.vhd:30]
INFO: [Synth 8-3491] module 'design_1_WhiteScreenGen_0_0' declared at 'C:/Users/lscho/Documents/GitHub/Digitaal-MO6-Pong/ScreenGen/WhiteScreenGen/.Xil/Vivado-34720-DESKTOP-0BAPC61/realtime/design_1_WhiteScreenGen_0_0_stub.vhdl:6' bound to instance 'WhiteScreenGen_0' of component 'design_1_WhiteScreenGen_0_0' [c:/Users/lscho/Documents/GitHub/Digitaal-MO6-Pong/ScreenGen/WhiteScreenGen/WhiteScreenGen.gen/sources_1/bd/design_1/synth/design_1.vhd:71]
INFO: [Synth 8-638] synthesizing module 'design_1_WhiteScreenGen_0_0' [C:/Users/lscho/Documents/GitHub/Digitaal-MO6-Pong/ScreenGen/WhiteScreenGen/.Xil/Vivado-34720-DESKTOP-0BAPC61/realtime/design_1_WhiteScreenGen_0_0_stub.vhdl:19]
INFO: [Synth 8-3491] module 'design_1_clk_wiz_0' declared at 'C:/Users/lscho/Documents/GitHub/Digitaal-MO6-Pong/ScreenGen/WhiteScreenGen/.Xil/Vivado-34720-DESKTOP-0BAPC61/realtime/design_1_clk_wiz_0_stub.vhdl:6' bound to instance 'clk_wiz' of component 'design_1_clk_wiz_0' [c:/Users/lscho/Documents/GitHub/Digitaal-MO6-Pong/ScreenGen/WhiteScreenGen/WhiteScreenGen.gen/sources_1/bd/design_1/synth/design_1.vhd:81]
INFO: [Synth 8-638] synthesizing module 'design_1_clk_wiz_0' [C:/Users/lscho/Documents/GitHub/Digitaal-MO6-Pong/ScreenGen/WhiteScreenGen/.Xil/Vivado-34720-DESKTOP-0BAPC61/realtime/design_1_clk_wiz_0_stub.vhdl:17]
INFO: [Synth 8-256] done synthesizing module 'design_1' (0#1) [c:/Users/lscho/Documents/GitHub/Digitaal-MO6-Pong/ScreenGen/WhiteScreenGen/WhiteScreenGen.gen/sources_1/bd/design_1/synth/design_1.vhd:30]
INFO: [Synth 8-256] done synthesizing module 'design_1_wrapper' (0#1) [C:/Users/lscho/Documents/GitHub/Digitaal-MO6-Pong/ScreenGen/WhiteScreenGen/WhiteScreenGen.gen/sources_1/bd/design_1/hdl/design_1_wrapper.vhd:26]
---------------------------------------------------------------------------------
Finished RTL Elaboration : Time (s): cpu = 00:00:06 ; elapsed = 00:00:06 . Memory (MB): peak = 2634.934 ; gain = 34.844
---------------------------------------------------------------------------------
---------------------------------------------------------------------------------
Start Handling Custom Attributes
---------------------------------------------------------------------------------
---------------------------------------------------------------------------------
Finished Handling Custom Attributes : Time (s): cpu = 00:00:06 ; elapsed = 00:00:06 . Memory (MB): peak = 2634.934 ; gain = 34.844
---------------------------------------------------------------------------------
---------------------------------------------------------------------------------
Finished RTL Optimization Phase 1 : Time (s): cpu = 00:00:06 ; elapsed = 00:00:06 . Memory (MB): peak = 2634.934 ; gain = 34.844
---------------------------------------------------------------------------------
INFO: [Project 1-454] Reading design checkpoint 'c:/Users/lscho/Documents/GitHub/Digitaal-MO6-Pong/ScreenGen/WhiteScreenGen/WhiteScreenGen.gen/sources_1/bd/design_1/ip/design_1_WhiteScreenGen_0_0/design_1_WhiteScreenGen_0_0.dcp' for cell 'design_1_i/WhiteScreenGen_0'
INFO: [Project 1-454] Reading design checkpoint 'c:/Users/lscho/Documents/GitHub/Digitaal-MO6-Pong/ScreenGen/WhiteScreenGen/WhiteScreenGen.gen/sources_1/bd/design_1/ip/design_1_clk_wiz_0/design_1_clk_wiz_0.dcp' for cell 'design_1_i/clk_wiz'
Netlist sorting complete. Time (s): cpu = 00:00:00 ; elapsed = 00:00:00 . Memory (MB): peak = 2634.934 ; gain = 0.000
INFO: [Netlist 29-17] Analyzing 1 Unisim elements for replacement
INFO: [Netlist 29-28] Unisim Transformation completed in 0 CPU seconds
INFO: [Project 1-479] Netlist was created with Vivado 2023.1
INFO: [Project 1-570] Preparing netlist for logic optimization

Processing XDC Constraints
Initializing timing engine
Parsing XDC File [c:/Users/lscho/Documents/GitHub/Digitaal-MO6-Pong/ScreenGen/WhiteScreenGen/WhiteScreenGen.gen/sources_1/bd/design_1/ip/design_1_clk_wiz_0/design_1_clk_wiz_0_board.xdc] for cell 'design_1_i/clk_wiz/inst'
Finished Parsing XDC File [c:/Users/lscho/Documents/GitHub/Digitaal-MO6-Pong/ScreenGen/WhiteScreenGen/WhiteScreenGen.gen/sources_1/bd/design_1/ip/design_1_clk_wiz_0/design_1_clk_wiz_0_board.xdc] for cell 'design_1_i/clk_wiz/inst'
Parsing XDC File [c:/Users/lscho/Documents/GitHub/Digitaal-MO6-Pong/ScreenGen/WhiteScreenGen/WhiteScreenGen.gen/sources_1/bd/design_1/ip/design_1_clk_wiz_0/design_1_clk_wiz_0.xdc] for cell 'design_1_i/clk_wiz/inst'
Finished Parsing XDC File [c:/Users/lscho/Documents/GitHub/Digitaal-MO6-Pong/ScreenGen/WhiteScreenGen/WhiteScreenGen.gen/sources_1/bd/design_1/ip/design_1_clk_wiz_0/design_1_clk_wiz_0.xdc] for cell 'design_1_i/clk_wiz/inst'
INFO: [Project 1-236] Implementation specific constraints were found while reading constraint file [c:/Users/lscho/Documents/GitHub/Digitaal-MO6-Pong/ScreenGen/WhiteScreenGen/WhiteScreenGen.gen/sources_1/bd/design_1/ip/design_1_clk_wiz_0/design_1_clk_wiz_0.xdc]. These constraints will be ignored for synthesis but will be used in implementation. Impacted constraints are listed in the file [.Xil/design_1_wrapper_propImpl.xdc].
Resolution: To avoid this warning, move constraints listed in [.Xil/design_1_wrapper_propImpl.xdc] to another XDC file and exclude this new file from synthesis with the used_in_synthesis property (File Properties dialog in GUI) and re-run elaboration/synthesis.
INFO: [Timing 38-2] Deriving generated clocks
Parsing XDC File [C:/Users/lscho/Documents/GitHub/Digitaal-MO6-Pong/ScreenGen/WhiteScreenGen/WhiteScreenGen.srcs/constrs_1/new/pindef.xdc]
Finished Parsing XDC File [C:/Users/lscho/Documents/GitHub/Digitaal-MO6-Pong/ScreenGen/WhiteScreenGen/WhiteScreenGen.srcs/constrs_1/new/pindef.xdc]
Completed Processing XDC Constraints

Netlist sorting complete. Time (s): cpu = 00:00:00 ; elapsed = 00:00:00 . Memory (MB): peak = 2634.934 ; gain = 0.000
INFO: [Project 1-111] Unisim Transformation Summary:
No Unisim elements were transformed.

RTL Elaboration Complete:  : Time (s): cpu = 00:00:14 ; elapsed = 00:00:09 . Memory (MB): peak = 2694.191 ; gain = 94.102
18 Infos, 0 Warnings, 0 Critical Warnings and 0 Errors encountered.
synth_design completed successfully
synth_design: Time (s): cpu = 00:00:14 ; elapsed = 00:00:09 . Memory (MB): peak = 2694.191 ; gain = 94.102
close_design
open_run impl_1
Netlist sorting complete. Time (s): cpu = 00:00:00 ; elapsed = 00:00:00 . Memory (MB): peak = 2723.992 ; gain = 0.000
INFO: [Project 1-479] Netlist was created with Vivado 2023.1
INFO: [Project 1-570] Preparing netlist for logic optimization
INFO: [Timing 38-478] Restoring timing data from binary archive.
INFO: [Timing 38-479] Binary timing data restore complete.
INFO: [Project 1-856] Restoring constraints from binary archive.
INFO: [Project 1-853] Binary constraint restore complete.
Reading XDEF placement.
Reading placer database...
Reading XDEF routing.
Read XDEF Files: Time (s): cpu = 00:00:00 ; elapsed = 00:00:00.032 . Memory (MB): peak = 3089.141 ; gain = 0.000
Restored from archive | CPU: 0.000000 secs | Memory: 0.000000 MB |
Finished XDEF File Restore: Time (s): cpu = 00:00:00 ; elapsed = 00:00:00.032 . Memory (MB): peak = 3089.141 ; gain = 0.000
Netlist sorting complete. Time (s): cpu = 00:00:00 ; elapsed = 00:00:00 . Memory (MB): peak = 3089.141 ; gain = 0.000
INFO: [Project 1-111] Unisim Transformation Summary:
No Unisim elements were transformed.

open_run: Time (s): cpu = 00:00:10 ; elapsed = 00:00:08 . Memory (MB): peak = 3154.703 ; gain = 430.711
disconnect_hw_server localhost:3121
connect_hw_server -allow_non_jtag
INFO: [Labtools 27-2285] Connecting to hw_server url TCP:localhost:3121
INFO: [Labtools 27-3415] Connecting to cs_server url TCP:localhost:0
INFO: [Labtools 27-3417] Launching cs_server...
INFO: [Labtools 27-2221] Launch Output:
ECHO is off.
ECHO is off.


******** Xilinx cs_server v2023.1.0
  ****** Build date   : Apr 10 2023-17:59:24
    **** Build number : 2023.1.1681142364
      ** Copyright 2017-2022 Xilinx, Inc. All Rights Reserved.
      ** Copyright 2022-2023 Advanced Micro Devices, Inc. All Rights Reserved.



ERROR: [Labtoolstcl 44-494] There is no active target available for server at localhost.
 Targets(s) ", jsn-€2-1234-tulAjsn-TUL-1234-tulA" may be locked by another hw_server.
disconnect_hw_server localhost:3121
connect_hw_server -allow_non_jtag
INFO: [Labtools 27-2285] Connecting to hw_server url TCP:localhost:3121
INFO: [Labtools 27-3415] Connecting to cs_server url TCP:localhost:0
INFO: [Labtools 27-3417] Launching cs_server...
INFO: [Labtools 27-2221] Launch Output:
ECHO is off.
ECHO is off.


******** Xilinx cs_server v2023.1.0
  ****** Build date   : Apr 10 2023-17:59:24
    **** Build number : 2023.1.1681142364
      ** Copyright 2017-2022 Xilinx, Inc. All Rights Reserved.
      ** Copyright 2022-2023 Advanced Micro Devices, Inc. All Rights Reserved.



ERROR: [Labtoolstcl 44-494] There is no active target available for server at localhost.
 Targets(s) ", jsn-€2-1234-tulAjsn-TUL-1234-tulA" may be locked by another hw_server.
exit
INFO: [Common 17-206] Exiting Vivado at Mon Oct 16 20:05:08 2023...
